{
  "$schema": "../schemas/draft.schema.json",
  "id": "draft_1704067200000_abc123",
  "title": "Best Phone Chargers 2024",
  "slug": "best-phone-chargers-2024",
  "status": "draft",
  "categorySlug": "electronics-accessories",
  "listType": "best-sellers",
  "productCount": 5,
  "currentVersion": 1,
  "createdAt": "2024-01-01T00:00:00.000Z",
  "updatedAt": "2024-01-02T00:00:00.000Z"
}
